<?xml version="1.0" encoding="UTF-8"?>
<tw:Spotify tw:version="1.0" xmlns:tw="http://tecnologiasweb.com.mx" xmlns:xsi="http://www.w3.org/2001/XMLSchema-instance" xsi:schemaLocation="http://tecnologiasweb.com.mx
                        spotify_ns.xsd">
    <tw:Cuenta tw:id="1" tw:plan="premium" tw:fechaIni="2022-02-01" tw:fechaFin="2023-02-01">
        <tw:Nombre>John Wick</tw:Nombre>
        <tw:Correo>john011@gmail.com</tw:Correo>
        <tw:Telefono tw:tipo="movil">000-123-4567</tw:Telefono>
    </tw:Cuenta>
    <tw:Cuenta tw:id="1" tw:plan="premium" tw:fechaIni="2022-02-01" tw:fechaFin="2023-02-01">
        <tw:Nombre>John Wick</tw:Nombre>
        <tw:Correo>john011@gmail.com</tw:Correo>
        <tw:Telefono tw:tipo="movil">000-123-4567</tw:Telefono>
    </tw:Cuenta>
</tw:Spotify>